1,5,1,2024-02-25 18:00,2024-01-03 21:11,Support Spay and Neuter Day,files/images/events/animal1.jpg,"Lorem ipsum dolor sit amet, consectetur adipiscing elit. Etiam sodales vel mi sit amet molestie. Suspendisse porttitor ultricies accumsan."
2,3,6,2024-02-26 11:00,2024-01-10 21:11,Come Skate on the Oval,files/images/events/skate3.jpg,Nullam sit amet quam mauris. Vestibulum lacinia libero non magna lobortis commodo. Curabitur venenatis eros non dapibus iaculis.
3,3,8,2024-02-27 20:00,2024-01-15 5:07,Learn to Ski,files/images/events/ski6.jpg,Nulla vitae enim quis sapien suscipit commodo. Curabitur ut pellentesque turpis. Aenean consectetur dignissim posuere.
4,4,2,2024-02-28 17:00,2024-02-01 14:08,Food/Wine Pairing,files/images/events/food1.jpg,"Nullam tincidunt metus in massa lobortis, at aliquet ligula tincidunt. Quisque nisi arcu, scelerisque eu nunc at, varius vehicula magna. "
5,2,3,2024-03-01 18:00,2024-02-18 9:18,Exhibition of Local Dance,files/images/events/dance1.jpg,Nullam tincidunt ante vitae est bibendum tempor. Vivamus non libero dolor. Etiam eget dui id erat congue ultrices porttitor non mauris.
6,5,4,2024-03-08 13:00,2024-02-20 21:27,Local bands compete to raise funds for national competition,files/images/events/music1.jpg,"Sed quis sagittis enim. Nullam non consequat est. Integer nec vestibulum velit. Donec posuere orci metus, nec porta odio pharetra sit amet. "
7,5,1,2024-06-02 13:00,2024-02-18 6:16,"Meet, Greet and Adapt Day",files/images/events/animal3.jpg,"Ut ullamcorper ipsum erat, ac fermentum metus congue nec. Aliquam et lorem vel risus maximus tempor sed ut nibh. Integer laoreet libero ac blandit aliquam. "
8,5,5,2024-06-25 17:00,2024-02-14 9:08,Auction of Local art to support local artists,files/images/events/art1.jpg,"Lorem ipsum dolor sit amet, consectetur adipiscing elit. Aliquam vitae eros metus. Integer porta, sapien sed sodales hendrerit, nunc purus sagittis libero, mattis molestie velit ex a quam."
9,1,4,2024-07-29 18:00,2024-02-17 21:31,Spring concert,files/images/events/music2.jpg,"Donec sagittis ipsum felis, vel maximus sapien ultricies id. Aenean eget dolor at nibh dapibus congue sit amet ut neque. Ut vehicula viverra massa, sollicitudin dapibus erat euismod sit amet."
10,4,2,2024-06-30 15:00,2024-02-19 21:31,Spring Hamper - Get Yours,files/images/events/food7.jpg,"Etiam nec massa ullamcorper, lobortis mauris aliquet, ultrices tellus. Aliquam erat volutpat. Phasellus lacinia ante arcu. Orci varius natoque penatibus et magnis dis parturient montes, nascetur ridiculus mus. "